{
  "name": "jeremydev87",
  "metadata": {
    "description": "JeremyDev87's Claude Code plugins - AI coding assistants for systematic development"
  },
  "owner": {
    "name": "JeremyDev87",
    "email": "soundbrokaz@kakao.com"
  },
  "plugins": [
    {
      "name": "codingbuddy",
      "source": "./packages/claude-code-plugin",
      "description": "PLAN/ACT/EVAL workflow, specialist agents, and reusable skills for systematic TDD development",
      "version": "5.1.3",
      "category": "development"
    }
  ]
}
